{
	"turns": [{
		"col": 6,
		"dir": "h",
		"pos": "8G",
		"row": 7,
		"nick": "andy",
		"note": "",
		"play": "GYP",
		"rack": "GPY",
		"type": "move",
		"cumul": 18,
		"score": 18
	}, {
		"col": 5,
		"dir": "h",
		"pos": "7F",
		"row": 6,
		"nick": "cesar",
		"note": "-3.5 seems like 7H AURA or 7I UTA are good. i did consider keeping the Z, but i couldn't think of a good play. but AIRTU kind of sucks, too.",
		"play": "ZA",
		"rack": "AAIRTUZ",
		"type": "move",
		"cumul": 16,
		"score": 16
	}, {
		"col": 6,
		"dir": "h",
		"pos": "6G",
		"row": 5,
		"nick": "andy",
		"note": "",
		"play": "THEW",
		"rack": "EHTW",
		"type": "move",
		"cumul": 40,
		"score": 22
	}, {
		"col": 8,
		"dir": "h",
		"pos": "5I",
		"row": 4,
		"nick": "cesar",
		"note": "",
		"play": "MAUT",
		"rack": "AIMRTTU",
		"type": "move",
		"cumul": 37,
		"score": 21
	}, {
		"col": 11,
		"dir": "v",
		"pos": "L2",
		"row": 1,
		"nick": "andy",
		"note": "",
		"play": "JOL.",
		"rack": "JLO",
		"type": "move",
		"cumul": 62,
		"score": 22
	}, {
		"col": 12,
		"dir": "v",
		"pos": "M1",
		"row": 0,
		"nick": "cesar",
		"note": "",
		"play": "TORI",
		"rack": "FIIORTT",
		"type": "move",
		"cumul": 60,
		"score": 23
	}, {
		"col": 13,
		"dir": "v",
		"pos": "N2",
		"row": 1,
		"nick": "andy",
		"note": "",
		"play": "BED",
		"rack": "BDE",
		"type": "move",
		"cumul": 105,
		"score": 43
	}, {
		"col": 9,
		"dir": "h",
		"pos": "7J",
		"row": 6,
		"nick": "cesar",
		"note": "",
		"play": "LIFT",
		"rack": "FIILRST",
		"type": "move",
		"cumul": 74,
		"score": 14
	}, {
		"nick": "andy",
		"note": "",
		"rack": "ABEIIRX",
		"type": "exchange",
		"cumul": 105,
		"exchanged": "IIAB"
	}, {
		"col": 14,
		"dir": "v",
		"pos": "O4",
		"row": 3,
		"nick": "cesar",
		"note": "i missed SORdINI. SIgNIOR is better defensively too, i wasn't 100% on it. -4.5",
		"play": "ORIgINS",
		"rack": "?IINORS",
		"type": "move",
		"cumul": 151,
		"score": 77
	}, {
		"col": 7,
		"dir": "h",
		"pos": "10H",
		"row": 9,
		"nick": "andy",
		"note": "",
		"play": "DRUtHER.",
		"rack": "?DEHRRU",
		"type": "move",
		"cumul": 170,
		"score": 65
	}, {
		"col": 9,
		"dir": "h",
		"pos": "11J",
		"row": 10,
		"nick": "cesar",
		"note": "i should not try to play defense when i'm down. how many times do i have to tell myself that? ABEL is better than ABE too. MOO is definitely better than my move. DOABLE is best which i just missed. (-6.5)",
		"play": "MOOL",
		"rack": "ABELMOO",
		"type": "move",
		"cumul": 176,
		"score": 25
	}, {
		"col": 7,
		"dir": "v",
		"pos": "H10",
		"row": 9,
		"nick": "andy",
		"note": "",
		"play": ".ACITE",
		"rack": "ACEIT",
		"type": "move",
		"cumul": 206,
		"score": 36
	}, {
		"col": 11,
		"dir": "h",
		"pos": "12L",
		"row": 11,
		"nick": "cesar",
		"note": "",
		"play": "EF",
		"rack": "ABEFGIN",
		"type": "move",
		"cumul": 204,
		"score": 28
	}, {
		"col": 0,
		"dir": "h",
		"pos": "5A",
		"row": 4,
		"nick": "andy",
		"note": "",
		"play": "AEGISES",
		"rack": "AEEGISS",
		"type": "move",
		"cumul": 277,
		"score": 71
	}, {
		"col": 0,
		"dir": "v",
		"pos": "A4",
		"row": 3,
		"nick": "cesar",
		"note": "quackle thinks i should go for the leave by playing 4A BOA. it is probably right. (-2)",
		"play": "B.GNIO",
		"rack": "AABGINO",
		"type": "move",
		"cumul": 240,
		"score": 36
	}, {
		"col": 2,
		"dir": "v",
		"pos": "C3",
		"row": 2,
		"nick": "andy",
		"note": "",
		"play": "VU.",
		"rack": "UV",
		"type": "move",
		"cumul": 291,
		"score": 14
	}, {
		"col": 12,
		"dir": "h",
		"pos": "1M",
		"row": 0,
		"nick": "cesar",
		"note": "",
		"play": ".AW",
		"rack": "AAACESW",
		"type": "move",
		"cumul": 265,
		"score": 25
	}, {
		"col": 5,
		"dir": "h",
		"pos": "14F",
		"row": 13,
		"nick": "andy",
		"note": "",
		"play": "VA.U",
		"rack": "AUV",
		"type": "move",
		"cumul": 306,
		"score": 15
	}, {
		"col": 12,
		"dir": "h",
		"pos": "9M",
		"row": 8,
		"nick": "cesar",
		"note": "damn vatu. DAMN IT. stupid game. i missed MOOLA, N9 ERA seems to be good there because it also sets up DELFS or something like that that i may need. DAN's leave isn't strong enough. -7",
		"play": "DA.",
		"rack": "AACDEES",
		"type": "move",
		"cumul": 283,
		"score": 18
	}, {
		"col": 1,
		"dir": "v",
		"pos": "B9",
		"row": 8,
		"nick": "andy",
		"note": "",
		"play": "EXTERN",
		"rack": "EENRTX",
		"type": "move",
		"cumul": 366,
		"score": 60
	}, {
		"col": 0,
		"dir": "h",
		"pos": "15A",
		"row": 14,
		"nick": "cesar",
		"note": "",
		"play": "CEP",
		"rack": "ACEELPS",
		"type": "move",
		"cumul": 318,
		"score": 35
	}, {
		"col": 0,
		"dir": "h",
		"pos": "12A",
		"row": 11,
		"nick": "andy",
		"note": "",
		"play": "K.NO",
		"rack": "KNO",
		"type": "move",
		"cumul": 392,
		"score": 26
	}, {
		"col": 1,
		"dir": "h",
		"pos": "13B",
		"row": 12,
		"nick": "cesar",
		"note": "no chance he's gonna leave it open. raya. -7",
		"play": ".AY",
		"rack": "AAELNSY",
		"type": "move",
		"cumul": 339,
		"score": 21
	}, {
		"col": 13,
		"dir": "h",
		"pos": "6N",
		"row": 5,
		"nick": "andy",
		"note": "15G D(E)NIER to block my out.",
		"play": "Q.",
		"rack": "DEIINQR",
		"type": "move",
		"cumul": 423,
		"score": 31
	}, {
		"col": 7,
		"dir": "h",
		"pos": "15H",
		"row": 14,
		"nick": "cesar",
		"note": "SOL is better than going out. -4",
		"play": ".NOLASE",
		"rack": "AELNOS",
		"type": "move",
		"cumul": 349,
		"score": 10
	}, {
		"nick": "cesar",
		"note": "",
		"rack": "DEINIR",
		"type": "end_rack_points",
		"cumul": 363,
		"score": 14
	}],
	"players": [{
		"nick": "andy",
		"p_number": 1,
		"real_name": "andy"
	}, {
		"nick": "cesar",
		"p_number": 2,
		"real_name": "cesar"
	}],
	"version": 1,
	"originalGCG": "#player1 andy andy\n#player2 cesar cesar\n>andy: GPY 8G GYP +18 18\n>cesar: AAIRTUZ 7F ZA +16 16\n#note -3.5 seems like 7H AURA or 7I UTA are good. i did consider keeping the Z, but i couldn't think of a good play. but AIRTU kind of sucks, too.\n>andy: EHTW 6G THEW +22 40\n>cesar: AIMRTTU 5I MAUT +21 37\n>andy: JLO L2 JOL. +22 62\n>cesar: FIIORTT M1 TORI +23 60\n>andy: BDE N2 BED +43 105\n>cesar: FIILRST 7J LIFT +14 74\n>andy: ABEIIRX -IIAB +0 105\n>cesar: ?IINORS O4 ORIgINS +77 151\n#note i missed SORdINI. SIgNIOR is better defensively too, i wasn't 100% on it. -4.5\n>andy: ?DEHRRU 10H DRUtHER. +65 170\n>cesar: ABELMOO 11J MOOL +25 176\n#note i should not try to play defense when i'm down. how many times do i have to tell myself that? ABEL is better than ABE too. MOO is definitely better than my move. DOABLE is best which i just missed. (-6.5)\n>andy: ACEIT H10 .ACITE +36 206\n>cesar: ABEFGIN 12L EF +28 204\n>andy: AEEGISS 5A AEGISES +71 277\n>cesar: AABGINO A4 B.GNIO +36 240\n#note quackle thinks i should go for the leave by playing 4A BOA. it is probably right. (-2)\n>andy: UV C3 VU. +14 291\n>cesar: AAACESW 1M .AW +25 265\n>andy: AUV 14F VA.U +15 306\n>cesar: AACDEES 9M DA. +18 283\n#note damn vatu. DAMN IT. stupid game. i missed MOOLA, N9 ERA seems to be good there because it also sets up DELFS or something like that that i may need. DAN's leave isn't strong enough. -7\n>andy: EENRTX B9 EXTERN +60 366\n>cesar: ACEELPS 15A CEP +35 318\n>andy: KNO 12A K.NO +26 392\n>cesar: AAELNSY 13B .AY +21 339\n#note no chance he's gonna leave it open. raya. -7\n>andy: DEIINQR 6N Q. +31 423\n#note 15G D(E)NIER to block my out.\n>cesar: AELNOS 15H .NOLASE +10 349\n#note SOL is better than going out. -4\n>cesar:  (DEINIR) +14 363"
}